{"captured_at":"2026-10-05T12:22:38.000Z","execution_manifest_sha256":"9475cbad9d915c4157feb352837acfbb9a8858103d6e695396355e1ab6f3a624","logs":{"availability":"available","locators":["/suc/study-1/b42ee7a8-4b45-43d7-8ca3-cb72ceae84c4/refund-provider","/suc/study-1/b42ee7a8-4b45-43d7-8ca3-cb72ceae84c4/treatment-controller","/suc/study-1/b42ee7a8-4b45-43d7-8ca3-cb72ceae84c4/durable-caller"],"reasons":[]},"metrics":{"availability":"available","locators":["AWS/Lambda/Errors/suc1-b42ee7a8-refund-provider","AWS/Lambda/Errors/suc1-b42ee7a8-treatment-controller","AWS/Lambda/Errors/suc1-b42ee7a8-durable-caller"],"reasons":[]},"record_type":"telemetry_availability","run_id":"b42ee7a8-4b45-43d7-8ca3-cb72ceae84c4","schema_version":1,"traces":{"availability":"available","locators":["xray/suc1-b42ee7a8-refund-provider","xray/suc1-b42ee7a8-treatment-controller","xray/suc1-b42ee7a8-durable-caller"],"reasons":[]},"trial_id":"af5fd7e2-4950-41df-baea-6ae3a692a869","trial_manifest_sha256":"9448fbaa5a1ae0b59e467bf0d678afc4d6e939b20aab8b73f2c353db604e2a21"}
