{"captured_at":"2026-10-05T12:39:08.000Z","execution_manifest_sha256":"9475cbad9d915c4157feb352837acfbb9a8858103d6e695396355e1ab6f3a624","logs":{"availability":"unavailable","locators":[],"reasons":[{"code":"TELEMETRY_UNAVAILABLE","detail":"the logs could not be read when the trial was collected; expected them available","subject":"BR-RUA-037"}]},"metrics":{"availability":"available","locators":["AWS/Lambda/Errors/suc1-b42ee7a8-refund-provider","AWS/Lambda/Errors/suc1-b42ee7a8-treatment-controller","AWS/Lambda/Errors/suc1-b42ee7a8-conventional-caller"],"reasons":[]},"record_type":"telemetry_availability","run_id":"b42ee7a8-4b45-43d7-8ca3-cb72ceae84c4","schema_version":1,"traces":{"availability":"available","locators":["xray/suc1-b42ee7a8-refund-provider","xray/suc1-b42ee7a8-treatment-controller","xray/suc1-b42ee7a8-conventional-caller"],"reasons":[]},"trial_id":"1549b47d-5c04-4f8c-98f1-789a4dc2eda2","trial_manifest_sha256":"dfe8eac839e51cdcc6595956ef1f9b871f58e1162552df111c4bb6eaf05a71bc"}
