{"captured_at":"2026-10-05T12:07:38.000Z","execution_manifest_sha256":"71a35c49621966449886309ad9797e6b5d8456cd60250c08e12084389fbbe5d7","logs":{"availability":"available","locators":["/suc/study-1/eaa57814-2764-44a3-8be5-f8b0b9fe6dc8/refund-provider","/suc/study-1/eaa57814-2764-44a3-8be5-f8b0b9fe6dc8/treatment-controller","/suc/study-1/eaa57814-2764-44a3-8be5-f8b0b9fe6dc8/conventional-caller"],"reasons":[]},"metrics":{"availability":"available","locators":["AWS/Lambda/Errors/suc1-eaa57814-refund-provider","AWS/Lambda/Errors/suc1-eaa57814-treatment-controller","AWS/Lambda/Errors/suc1-eaa57814-conventional-caller"],"reasons":[]},"record_type":"telemetry_availability","schema_version":1,"traces":{"availability":"available","locators":["xray/suc1-eaa57814-refund-provider","xray/suc1-eaa57814-treatment-controller","xray/suc1-eaa57814-conventional-caller"],"reasons":[]},"trial_id":"67a009ab-465b-4085-8157-0d15a907e849","trial_manifest_sha256":"c0d9492ef7644488aa83af58942034b7ef6679161cd7d022bf27ff29b7bcc114","variant_validation_id":"eaa57814-2764-44a3-8be5-f8b0b9fe6dc8"}
