{"captured_at":"2026-10-05T12:07:38.000Z","execution_manifest_sha256":"af35e6d638e19a1746b17b1146bcd86c0e64a5f88c8518c79067e5d9cfd18540","logs":{"availability":"available","locators":["/suc/study-1/0a057d57-a288-41ea-a709-6b6fb3e9cfdb/refund-provider","/suc/study-1/0a057d57-a288-41ea-a709-6b6fb3e9cfdb/treatment-controller","/suc/study-1/0a057d57-a288-41ea-a709-6b6fb3e9cfdb/durable-caller"],"reasons":[]},"metrics":{"availability":"available","locators":["AWS/Lambda/Errors/suc1-0a057d57-refund-provider","AWS/Lambda/Errors/suc1-0a057d57-treatment-controller","AWS/Lambda/Errors/suc1-0a057d57-durable-caller"],"reasons":[]},"record_type":"telemetry_availability","schema_version":1,"traces":{"availability":"available","locators":["xray/suc1-0a057d57-refund-provider","xray/suc1-0a057d57-treatment-controller","xray/suc1-0a057d57-durable-caller"],"reasons":[]},"trial_id":"58801aff-e332-43a3-b0e2-be49b0243a84","trial_manifest_sha256":"7056d033f0194d92b0103320c04e315c8ed32bc4aab750c2f2d83bf766349535","variant_validation_id":"0a057d57-a288-41ea-a709-6b6fb3e9cfdb"}
