{"captured_at":"2026-10-07T06:12:07.071Z","execution_manifest_sha256":"3d26529048074578c43c303781c3ff54d17c0f4f22f6916fa1348955b66f202e","logs":{"availability":"unavailable","locators":[],"reasons":[{"code":"TELEMETRY_NOT_FOUND","detail":"logs lookup found no locator; expected at least one","subject":"BR-RUA-037"}]},"metrics":{"availability":"available","locators":["AWS/Lambda:Invocations:FunctionName=SucRua-run-abf41ffd-DurableVariantCallerFunction28-Ah0gp4kx2B0O","AWS/Lambda:Invocations:FunctionName=SucRua-run-abf41ffd-ExperimentCoreProviderFunction-KX7W2zXKz9Ia","AWS/Lambda:Invocations:FunctionName=SucRua-run-abf41ffd-ExperimentCoreControllerFuncti-5ZhnsGshOVZv"],"reasons":[]},"record_type":"telemetry_availability","run_id":"abf41ffd-3008-4b29-81ee-b65d8095188b","schema_version":1,"traces":{"availability":"unavailable","locators":[],"reasons":[{"code":"TELEMETRY_NOT_FOUND","detail":"traces lookup found no locator; expected at least one","subject":"BR-RUA-037"}]},"trial_id":"5a9bbf55-54bf-4ea8-ab29-f5a83b57a288","trial_manifest_sha256":"19565e5abacd02b33032a6b305e4d28080569f1ff7c327cfa3a2e83fb5810bb3"}
