{"captured_at":"2026-10-07T06:16:45.975Z","execution_manifest_sha256":"3d26529048074578c43c303781c3ff54d17c0f4f22f6916fa1348955b66f202e","logs":{"availability":"available","locators":["/suc/study-1/abf41ffd-3008-4b29-81ee-b65d8095188b/treatment-controller"],"reasons":[]},"metrics":{"availability":"available","locators":["AWS/Lambda:Invocations:FunctionName=SucRua-run-abf41ffd-ConventionalVariantCallerFunct-AgFCzYYhPKck","AWS/Lambda:Invocations:FunctionName=SucRua-run-abf41ffd-ExperimentCoreProviderFunction-KX7W2zXKz9Ia","AWS/Lambda:Invocations:FunctionName=SucRua-run-abf41ffd-ExperimentCoreControllerFuncti-5ZhnsGshOVZv"],"reasons":[]},"record_type":"telemetry_availability","run_id":"abf41ffd-3008-4b29-81ee-b65d8095188b","schema_version":1,"traces":{"availability":"unavailable","locators":[],"reasons":[{"code":"TELEMETRY_NOT_FOUND","detail":"traces lookup found no locator; expected at least one","subject":"BR-RUA-037"}]},"trial_id":"2c1a67fd-3a63-4028-ab2c-61ded755769f","trial_manifest_sha256":"6805f8b3d3164a1a687046fc2a0eb8bfb8e150e83c2ab012dad2d300dcd6c2a2"}
