{"captured_at":"2026-10-07T03:52:46.105Z","execution_manifest_sha256":"a1fd75394f2597338ef92b3c3bd946ac15aeb4aa34f1557e1ed54505c0111a4c","logs":{"availability":"available","locators":["/suc/study-1/4f4a29c7-a8ee-4d30-ac2a-5cc5be9f2ce5/treatment-controller"],"reasons":[]},"metrics":{"availability":"available","locators":["AWS/Lambda:Invocations:FunctionName=SucRua-probe-4f4a29c7-ProbeCallerFunctionF830558B-slsfem753RZP","AWS/Lambda:Invocations:FunctionName=SucRua-probe-4f4a29c7-ExperimentCoreProviderFuncti-7m3Fz9GiubeW","AWS/Lambda:Invocations:FunctionName=SucRua-probe-4f4a29c7-ExperimentCoreControllerFunc-HSd38q3JW9xu"],"reasons":[]},"record_type":"telemetry_availability","schema_version":1,"traces":{"availability":"unavailable","locators":[],"reasons":[{"code":"TELEMETRY_NOT_FOUND","detail":"traces lookup found no locator; expected at least one","subject":"BR-RUA-037"}]},"transport_probe_id":"4f4a29c7-a8ee-4d30-ac2a-5cc5be9f2ce5"}
