{"captured_at":"2026-10-07T05:23:23.855Z","execution_manifest_sha256":"5ea4e7511b1528b46c6b7f3a3e0d6e1819a39ed832467ba33840a88198fc1afa","logs":{"availability":"unavailable","locators":[],"reasons":[{"code":"TELEMETRY_NOT_FOUND","detail":"logs lookup found no locator; expected at least one","subject":"BR-RUA-037"}]},"metrics":{"availability":"available","locators":["AWS/Lambda:Invocations:FunctionName=SucRua-validation-eda6019-DurableVariantCallerFunc-lnfGqyIcceVE","AWS/Lambda:Invocations:FunctionName=SucRua-validation-eda6019-ExperimentCoreProviderFu-hLMbA10yKOGw","AWS/Lambda:Invocations:FunctionName=SucRua-validation-eda6019-ExperimentCoreController-Q58pp4ou8NTI"],"reasons":[]},"record_type":"telemetry_availability","schema_version":1,"traces":{"availability":"unavailable","locators":[],"reasons":[{"code":"TELEMETRY_NOT_FOUND","detail":"traces lookup found no locator; expected at least one","subject":"BR-RUA-037"}]},"trial_id":"7aeb0d62-5c7e-4494-9002-0063c4e65f03","trial_manifest_sha256":"841b8637ca840fe97576069953c47732fdf88a87aea0e91cac8c78fd39ec4043","variant_validation_id":"eda6019a-0f5d-4565-a809-b129ec432036"}
