{"captured_at":"2026-10-07T04:58:07.039Z","execution_manifest_sha256":"5459474242d205254c43b902dc31625e8ad7681fb9dafcba08a53ee38be92fec","logs":{"availability":"unavailable","locators":[],"reasons":[{"code":"TELEMETRY_NOT_FOUND","detail":"logs lookup found no locator; expected at least one","subject":"BR-RUA-037"}]},"metrics":{"availability":"available","locators":["AWS/Lambda:Invocations:FunctionName=SucRua-validation-a8a5b2f-ConventionalVariantCalle-4VzSBEBNEKO2","AWS/Lambda:Invocations:FunctionName=SucRua-validation-a8a5b2f-ExperimentCoreProviderFu-is3gggR6OazM","AWS/Lambda:Invocations:FunctionName=SucRua-validation-a8a5b2f-ExperimentCoreController-lwfff19C1imL"],"reasons":[]},"record_type":"telemetry_availability","schema_version":1,"traces":{"availability":"unavailable","locators":[],"reasons":[{"code":"TELEMETRY_NOT_FOUND","detail":"traces lookup found no locator; expected at least one","subject":"BR-RUA-037"}]},"trial_id":"d0f24b36-9215-492e-80cf-e567f0977476","trial_manifest_sha256":"fd1f3480f44a4c5bd8012e4b0b624d311b5a9db81cd0e2ee54269757e03b9920","variant_validation_id":"a8a5b2f1-61d2-4712-9c54-34114abfd54e"}
